<ROMEFrameworkDefinition xmlns:xsi="http://www.w3.org/2001/XMLSchema-instance" xsi:noNamespaceSchemaLocation="c:/rome/rome/rome.xsd">
	<Experiment>
		<ExperimentShortCut>XYZ</ExperimentShortCut>
		<ProgramName>Analyzer</ProgramName>
	</Experiment>
	<Folders>
		<Folder>
			<FolderName>PMTData</FolderName>
			<ArraySize>10</ArraySize>
			<Field>
				<FieldName>ADC</FieldName>
				<FieldType>Int_t</FieldType>
				<FieldComment>ADC Value of a PMT</FieldComment>
			</Field>
		</Folder>
	</Folders>
	<Tasks>
		<Task>
			<TaskName>PrintADCValues</TaskName>
		</Task>
	</Tasks>
	<Trees>
		<Tree>
			<TreeName>DataTree</TreeName>
			<Branch>
				<BranchName>PMTDataBranch</BranchName>
				<RelatedFolder>PMTData</RelatedFolder>
			</Branch>
		</Tree>
	</Trees>
	<GlobalSteeringParameters>
		<SteeringParameterField>
			<SPFieldName>OutputOnOff</SPFieldName>
			<SPFieldType>bool</SPFieldType>
		</SteeringParameterField>
	</GlobalSteeringParameters>
	<UserDAQSystems>
		<UserDAQSystem>
			<DAQSystemName>mydaq</DAQSystemName>
		</UserDAQSystem>
	</UserDAQSystems>
</ROMEFrameworkDefinition>
