<ROMEFrameworkDefinition xmlns:xsi="http://www.w3.org/2001/XMLSchema-instance" xsi:noNamespaceSchemaLocation="c:/rome/rome/rome.xsd">
	<Experiment>
		<ExperimentShortCut>TH</ExperimentShortCut>
		<ProgramName>Example</ProgramName>
	</Experiment>
	<Tasks>
		<Task>
			<TaskName>MyTask</TaskName>
			<SteeringParameters>
				<SteeringParameterField>
					<SPFieldName>output</SPFieldName>
					<SPFieldType>ROMEString</SPFieldType>
					<SPFieldInitialization>"xxx"</SPFieldInitialization>
				</SteeringParameterField>
			</SteeringParameters>
		</Task>
	</Tasks>
	<TaskHierarchy>
		<Task>
			<TaskName>MyTask</TaskName>
		</Task>
		<Task>
			<TaskName>MyTask</TaskName>
		</Task>
	</TaskHierarchy>
</ROMEFrameworkDefinition>
