<ROMEFrameworkDefinition xmlns:xsi="http://www.w3.org/2001/XMLSchema-instance" xsi:noNamespaceSchemaLocation="c:/rome/rome.xsd">
	<Experiment>
		<ExperimentShortCut>MID</ExperimentShortCut>
		<ProgramName>Analyzer</ProgramName>
	</Experiment>
	<Folders>
		<Folder>
			<FolderName>Data</FolderName>
			<Field>
				<FieldName>ADC</FieldName>
				<FieldType>Int_t</FieldType>
				<ArraySize>8</ArraySize>
				<FieldComment>ADC Values</FieldComment>
			</Field>
			<Field>
				<FieldName>TDC</FieldName>
				<FieldType>Int_t</FieldType>
				<ArraySize>8</ArraySize>
				<FieldComment>TDC Values</FieldComment>
			</Field>
		</Folder>
	</Folders>
	<Tasks>
		<Task>
			<TaskName>PrintValues</TaskName>
		</Task>
	</Tasks>
	<MidasBanks>
		<EventDefinition>
			<EventName>Trigger</EventName>
			<EventID>1</EventID>
			<EventTriggerMask>-1</EventTriggerMask>
			<EventSamplingRate>2</EventSamplingRate>
			<Banks>
				<Bank>
					<BankName>ADC0</BankName>
					<BankType>WORD</BankType>
				</Bank>
				<Bank>
					<BankName>TDC0</BankName>
					<BankType>WORD</BankType>
				</Bank>
			</Banks>
		</EventDefinition>
	</MidasBanks>
</ROMEFrameworkDefinition>
