<ROMEFrameworkDefinition xmlns:xsi="http://www.w3.org/2001/XMLSchema-instance" xsi:noNamespaceSchemaLocation="c:/rome/rome.xsd">
	<Experiment>
		<ExperimentShortCut>MCR</ExperimentShortCut>
		<ProgramName>Analyzer</ProgramName>
	</Experiment>
	<Folders>
		<Folder>
			<FolderName>PMTData</FolderName>
			<ArraySize>10</ArraySize>
			<Field>
				<FieldName>ADC</FieldName>
				<FieldType>Int_t</FieldType>
				<FieldComment>ADC Value of a PMT</FieldComment>
			</Field>
		</Folder>
		<Folder>
			<FolderName>Sum</FolderName>
			<Field>
				<FieldName>ADCSum</FieldName>
				<FieldType>Int_t</FieldType>
				<FieldComment>Sum of ADC Value of a PMT</FieldComment>
			</Field>
		</Folder>
	</Folders>
	<Tasks>
		<Task>
			<TaskName>TakingSum</TaskName>
		</Task>
	</Tasks>
	<UserDAQSystems>
		<UserDAQSystem>
			<DAQSystemName>dummy</DAQSystemName>
		</UserDAQSystem>
	</UserDAQSystems>
	<Trees>
		<Tree>
			<TreeName>DataTree</TreeName>
			<Branch>
				<BranchName>pmt</BranchName>
				<RelatedFolder>PMTData</RelatedFolder>
			</Branch>
			<Branch>
				<BranchName>sum</BranchName>
				<RelatedFolder>Sum</RelatedFolder>
			</Branch>
		</Tree>
	</Trees>
</ROMEFrameworkDefinition>
