<ROMEFrameworkDefinition xmlns:xsi="http://www.w3.org/2001/XMLSchema-instance" xsi:noNamespaceSchemaLocation="c:/rome/rome.xsd">
	<Experiment>
		<ExperimentShortCut>TWR2</ExperimentShortCut>
		<ProgramName>Sample</ProgramName>
		<ProgramDefinitionVersion>$Rev$</ProgramDefinitionVersion>
	</Experiment>
	<Folders>
		<Folder>
			<FolderName>Track</FolderName>
			<Field>
				<FieldName>ntrack</FieldName>
				<FieldType>Int_t</FieldType>
				<FieldComment># of tracks</FieldComment>
				<FieldInitialization>0</FieldInitialization>
			</Field>
			<Field>
				<FieldName>particleid</FieldName>
				<FieldType>Int_t</FieldType>
				<FieldComment>[ntrack] geant particle code</FieldComment>
				<ArraySize>variable</ArraySize>
			</Field>
		</Folder>
		<Folder>
			<FolderName>RawPointerSplit</FolderName>
			<FolderTitle>Raw with pointer of Data</FolderTitle>
			<ArraySize>10</ArraySize>
			<NoResetByFramework>true</NoResetByFramework>
			<FolderVersion>$Rev$</FolderVersion>
			<FolderDescription>Folder to store calorimeter raw data.</FolderDescription>
			<Include>
				<IncludeName>RawData.h</IncludeName>
				<IncludeType>local</IncludeType>
			</Include>
			<Field>
				<FieldName>Data</FieldName>
				<FieldType>RawData*</FieldType>
				<FieldComment>|| Raw Data</FieldComment>
				<InheritTObject>true</InheritTObject>
			</Field>
		</Folder>
		<Folder>
			<FolderName>RawPointerNoSplit</FolderName>
			<FolderTitle>Raw with pointer of Data</FolderTitle>
			<ArraySize>10</ArraySize>
			<NoResetByFramework>true</NoResetByFramework>
			<FolderVersion>$Rev$</FolderVersion>
			<FolderDescription>Folder to store calorimeter raw data.</FolderDescription>
			<Include>
				<IncludeName>RawData.h</IncludeName>
				<IncludeType>local</IncludeType>
			</Include>
			<Field>
				<FieldName>Data</FieldName>
				<FieldType>RawData*</FieldType>
				<FieldComment>|| Raw Data</FieldComment>
				<InheritTObject>true</InheritTObject>
			</Field>
		</Folder>
		<Folder>
			<FolderName>RawSplit</FolderName>
			<FolderTitle>Raw with Data</FolderTitle>
			<ArraySize>10</ArraySize>
			<NoResetByFramework>true</NoResetByFramework>
			<FolderVersion>$Rev$</FolderVersion>
			<FolderDescription>Folder to store calorimeter raw data.</FolderDescription>
			<Include>
				<IncludeName>RawData.h</IncludeName>
				<IncludeType>local</IncludeType>
			</Include>
			<Field>
				<FieldName>Data</FieldName>
				<FieldType>RawData</FieldType>
				<FieldComment>|| Raw Data</FieldComment>
				<InheritTObject>true</InheritTObject>
			</Field>
		</Folder>
		<Folder>
			<FolderName>RawNoSplit</FolderName>
			<FolderTitle>Raw with Data</FolderTitle>
			<ArraySize>10</ArraySize>
			<NoResetByFramework>true</NoResetByFramework>
			<FolderVersion>$Rev$</FolderVersion>
			<FolderDescription>Folder to store calorimeter raw data.</FolderDescription>
			<Include>
				<IncludeName>RawData.h</IncludeName>
				<IncludeType>local</IncludeType>
			</Include>
			<Field>
				<FieldName>Data</FieldName>
				<FieldType>RawData</FieldType>
				<FieldComment>|| Raw Data</FieldComment>
				<InheritTObject>true</InheritTObject>
			</Field>
		</Folder>
	</Folders>
	<Tasks>
		<Task>
			<TaskName>FillTree</TaskName>
		</Task>
		<Task>
			<TaskName>PrintValue</TaskName>
		</Task>
	</Tasks>
	<Trees>
		<Tree>
			<TreeName>MyTree</TreeName>
			<Branch>
				<BranchName>TrackBranch</BranchName>
				<RelatedFolder>Track</RelatedFolder>
			</Branch>
			<Branch>
				<BranchName>RawPointerSplitBranch</BranchName>
				<RelatedFolder>RawPointerSplit</RelatedFolder>
				<SplitLevel>99</SplitLevel>
			</Branch>
			<Branch>
				<BranchName>RawPointerNoSplitBranch</BranchName>
				<RelatedFolder>RawPointerNoSplit</RelatedFolder>
				<SplitLevel>0</SplitLevel>
			</Branch>
			<Branch>
				<BranchName>RawSplitBranch</BranchName>
				<RelatedFolder>RawSplit</RelatedFolder>
				<SplitLevel>99</SplitLevel>
			</Branch>
			<Branch>
				<BranchName>RawNoSplitBranch</BranchName>
				<RelatedFolder>RawNoSplit</RelatedFolder>
				<SplitLevel>0</SplitLevel>
			</Branch>
		</Tree>
	</Trees>
	<UserMakeFile>
		<DictionaryHeaders>
			<Header>
				<HeaderName>$(ROMESYS)/examples/tree_write_read2/RawData.h</HeaderName>
			</Header>
		</DictionaryHeaders>
		<AdditionalFiles>
			<File>
				<SourceFile>$(ROMESYS)/examples/tree_write_read2/RawData.cpp</SourceFile>
			</File>
		</AdditionalFiles>AdditionalFiles>
	</UserMakeFile>
</ROMEFrameworkDefinition>
