<ROMEFrameworkDefinition xmlns:xsi="http://www.w3.org/2001/XMLSchema-instance" xsi:noNamespaceSchemaLocation="c:/rome/rome.xsd">
	<Experiment>
		<ExperimentShortCut>BF</ExperimentShortCut>
		<ProgramName>Sample</ProgramName>
		<ProgramDefinitionVersion>$Rev$</ProgramDefinitionVersion>
	</Experiment>
	<Folders>
		<Folder>
			<FolderName>MyFolder</FolderName>
                        <DataBaseAccess>true</DataBaseAccess>
			<Inherit>MyBaseFolder</Inherit>
			<Field>
				<FieldName>MyValue</FieldName>
				<FieldType>Int_t</FieldType>
                                <DataBaseName>mydatabase</DataBaseName>
                                <DataBasePath>"/CCC[id=#]/BBB/bbb"</DataBasePath>
			</Field>
		</Folder>
		<Folder>
			<FolderName>MyBaseFolder</FolderName>
                        <DataBaseAccess>true</DataBaseAccess>
			<Inherit>MyBaseBaseFolder</Inherit>
			<Field>
				<FieldName>MyBaseValue</FieldName>
				<FieldType>Int_t</FieldType>
                                <DataBaseName>mydatabase</DataBaseName>
                                <DataBasePath>"/BBB[id=#]/BBB/bbb"</DataBasePath>
			</Field>
		</Folder>
		<Folder>
			<FolderName>MyBaseBaseFolder</FolderName>
                        <DataBaseAccess>true</DataBaseAccess>
			<Field>
				<FieldName>MyBaseBaseValue</FieldName>
				<FieldType>Int_t</FieldType>
                                <DataBaseName>mydatabase</DataBaseName>
                                <DataBasePath>"/AAA[id=#]/BBB/bbb"</DataBasePath>
			</Field>
		</Folder>
	</Folders>
	<Tasks>
		<Task>
			<TaskName>FillFolder</TaskName>
		</Task>
	</Tasks>
	<Trees>
		<Tree>
			<TreeName>MyTree</TreeName>
			<Branch>
				<BranchName>MyBranch</BranchName>
				<RelatedFolder>MyFolder</RelatedFolder>
			</Branch>
		</Tree>
	</Trees>
</ROMEFrameworkDefinition>
